{
  "pr": "123",
  "previewProfile": "order-service",
  "namespace": "pr-123",
  "applicationName": "preview-pr-123-order-service",
  "affectedComponents": "order-service",
  "smokeProfiles": "order-service",
  "images": {
    "frontend": "ghcr.io/nguyenthanhdat2707/mini-book-hub-frontend@sha256:stablefrontend",
    "book-service": "ghcr.io/nguyenthanhdat2707/mini-book-hub-book-service@sha256:stablebookservice",
    "reader-service": "ghcr.io/nguyenthanhdat2707/mini-book-hub-reader-service@sha256:stablereaderservice",
    "order-service": "ghcr.io/nguyenthanhdat2707/mini-book-hub-order-service@sha256:candidateorderservice"
  }
}
